### DISCUSSION TITLE
Kratos container sends outbound DNS lookup requests for localhost.<domain>

### DISCUSSION THREAD

**Discussion by jertel** [ory/kratos#1070] [Q&A] [answered]
This discussion is being posted for long-term preservation. It was originally discussed in the Ory Kratos Slack chat:
--------------------------------------------------------------------

I'm seeing DNS lookups for localhost.<domain>.<tld> occuring roughly on 30 second intervals. I'm exec'd into the kratos container and it has localhost defined in /etc/hosts. Can anyone point me to why this is occurring or kratos scheduled jobs/cache timeouts that could explain this?

More details:

If I modify the dockerfile for Kratos to have an entrypoint of /bin/sh, and then apk add tcpdump there are no DNS lookups for "localhost.<mydomain>.<mytld>." If I then docker exec into the container in another terminal and startup kratos, immediately there's an outbound DNS lookup for that localhost.xxx.yyy name. It then repeats every 30 seconds. It's consistently reproducible.

The config file settings appear to not have an impact on this, as any URLs, hostnames I define in the config does not stop the "localhost.<domain>" lookups.

Below is a tcpdump output (from within the container) starting right a couple minutes before I launched the kratos process inside the container. At 19:51:16 I started kratos in another terminal window, via docker exec. Immediately after that PTR request, there's a localhost.home.mypersonaldomain.com lookup. That repeats roughly every 30 seconds. If I then kill kratos in the second terminal window, the localhost lookups cease.

```
19:51:03.811409 IP 172.17.0.1.48334 > 239.255.255.250.1900: UDP, length 167
19:51:04.812416 IP 172.17.0.1.48334 > 239.255.255.250.1900: UDP, length 167
19:51:05.813520 IP 172.17.0.1.48334 > 239.255.255.250.1900: UDP, length 167
19:51:06.814319 IP 172.17.0.1.48334 > 239.255.255.250.1900: UDP, length 167
19:51:10.913214 IP 172.17.0.2.33716 > 239.255.255.250.1900: UDP, length 146
19:51:10.913291 IP 172.17.0.2.41620 > 239.255.255.250.1900: UDP, length 146
19:51:11.013715 IP 172.17.0.2.33716 > 239.255.255.250.1900: UDP, length 146
19:51:11.013767 IP 172.17.0.2.41620 > 239.255.255.250.1900: UDP, length 146
19:51:11.114162 IP 172.17.0.2.33716 > 239.255.255.250.1900: UDP, length 146
19:51:11.114217 IP 172.17.0.2.41620 > 239.255.255.250.1900: UDP, length 146
19:51:16.939246 IP6 fe80::e4b4:12ff:aabb:ccdd.5353 > ff02::fb.5353: 0 [9q] PTR (QM)? _ipps._tcp.local. PTR (QM)? _ftp._tcp.local. PTR (QM)? _webdav._tcp.local. PTR (QM)? _webdavs._tcp.local. PTR (QM)? _sftp-ssh._tcp.local. PTR (QM)? _smb._tcp.local. PTR (QM)? _afpovertcp._tcp.local. PTR (QM)? _nfs._tcp.local. PTR (QM)? _ipp._tcp.local. (141)
19:51:17.049277 IP 02f23d91b430.37260 > firewall.home.mypersonaldomain.com.53: 47636+ AAAA? localhost.home.mypersonaldomain.com. (47)
19:51:17.049277 IP 02f23d91b430.46393 > firewall.home.mypersonaldomain.com.53: 49474+ A? localhost.home.mypersonaldomain.com. (47)
19:51:17.049496 IP firewall.home.mypersonaldomain.com.53 > 02f23d91b430.46393: 49474* 1/0/0 A 127.0.0.1 (63)
19:51:17.049508 IP firewall.home.mypersonaldomain.com.53 > 02f23d91b430.37260: 47636* 1/0/0 AAAA ::1 (75)
19:51:22.189964 ARP, Request who-has 02f23d91b430 tell 172.17.0.1, length 28
19:51:22.189972 ARP, Request who-has 172.17.0.1 tell 02f23d91b430, length 28
19:51:22.189979 ARP, Reply 02f23d91b430 is-at 02:42:ac:11:00:0a (oui Unknown), length 28
19:51:22.189990 ARP, Reply 172.17.0.1 is-at 02:42:ee:78:b9:ab (oui Unknown), length 28
19:51:34.221997 IP6 fe80::e4b4:12ff:aabb:ccdd > ip6-allrouters: ICMP6, router solicitation, length 16
19:51:46.051222 IP 02f23d91b430.45202 > firewall.home.mypersonaldomain.com.53: 56519+ AAAA? localhost.home.mypersonaldomain.com. (47)
19:51:46.051222 IP 02f23d91b430.51812 > firewall.home.mypersonaldomain.com.53: 52197+ A? localhost.home.mypersonaldomain.com. (47)
19:51:46.051495 IP firewall.home.mypersonaldomain.com.53 > 02f23d91b430.51812: 52197* 1/0/0 A 127.0.0.1 (63)
19:51:46.051537 IP firewall.home.mypersonaldomain.com.53 > 02f23d91b430.45202: 56519* 1/0/0 AAAA ::1 (75)
19:52:01.266030 IP6 fe80::42:eeff:1122.3344.5353 > ff02::fb.5353: 0 [7q] PTR (QM)? _ftp._tcp.local. PTR (QM)? _nfs._tcp.local. PTR (QM)? _afpovertcp._tcp.local. PTR (QM)? _smb._tcp.local. PTR (QM)? _sftp-ssh._tcp.local. PTR (QM)? _webdavs._tcp.local. PTR (QM)? _webdav._tcp.local. (118)
19:52:01.266128 IP 172.17.0.1.5353 > 224.0.0.251.5353: 0 [7q] PTR (QM)? _ftp._tcp.local. PTR (QM)? _nfs._tcp.local. PTR (QM)? _afpovertcp._tcp.local. PTR (QM)? _smb._tcp.local. PTR (QM)? _sftp-ssh._tcp.local. PTR (QM)? _webdavs._tcp.local. PTR (QM)? _webdav._tcp.local. (118)
19:52:01.266216 IP 02f23d91b430.39772 > firewall.home.mypersonaldomain.com.53: 13346+ PTR? b.a.9.b.8.7.e.f.f.f.e.e.2.4.0.0.0.0.0.0.0.0.0.0.0.0.0.0.0.8.e.f.ip6.arpa. (90)
19:52:01.266430 IP firewall.home.mypersonaldomain.com.53 > 02f23d91b430.39772: 13346 NXDomain* 0/1/0 (149)
19:52:01.266568 IP 02f23d91b430.41674 > firewall.home.mypersonaldomain.com.53: 15243+ PTR? 251.0.0.224.in-addr.arpa. (42)
19:52:01.294839 IP firewall.home.mypersonaldomain.com.53 > 02f23d91b430.41674: 15243 NXDomain 0/1/0 (99)
19:52:06.477980 ARP, Request who-has 172.17.0.1 tell 02f23d91b430, length 28
19:52:06.477989 ARP, Request who-has 02f23d91b430 tell 172.17.0.1, length 28
19:52:06.477998 ARP, Reply 02f23d91b430 is-at 02:42:ac:11:00:0a (oui Unknown), length 28
19:52:06.478002 ARP, Reply 172.17.0.1 is-at 02:42:ee:78:b9:ab (oui Unknown), length 28
19:52:10.910901 IP 172.17.0.2.33716 > 239.255.255.250.1900: UDP, length 146
19:52:10.911004 IP 172.17.0.2.41620 > 239.255.255.250.1900: UDP, length 146
19:52:11.011318 IP 172.17.0.2.33716 > 239.255.255.250.1900: UDP, length 146
19:52:11.011383 IP 172.17.0.2.41620 > 239.255.255.250.1900: UDP, length 146
19:52:11.113182 IP 172.17.0.2.33716 > 239.255.255.250.1900: UDP, length 146
19:52:11.113235 IP 172.17.0.2.41620 > 239.255.255.250.1900: UDP, length 146
19:52:16.053406 IP 02f23d91b430.57210 > firewall.home.mypersonaldomain.com.53: 38941+ A? localhost.home.mypersonaldomain.com. (47)
19:52:16.053406 IP 02f23d91b430.52305 > firewall.home.mypersonaldomain.com.53: 56150+ AAAA? localhost.home.mypersonaldomain.com. (47)
19:52:16.053671 IP firewall.home.mypersonaldomain.com.53 > 02f23d91b430.52305: 56150* 1/0/0 AAAA ::1 (75)
19:52:16.053700 IP firewall.home.mypersonaldomain.com.53 > 02f23d91b430.57210: 38941* 1/0/0 A 127.0.0.1 (63)
```

**Comment by jertel** [comment]
It looks like the localhost FQDN part of the problem is a known issue with golang:

- https://github.com/gliderlabs/docker-alpine/issues/367
- https://github.com/golang/go/issues/32017.

I can work around this with an additional line in my Dockerfile:
```
RUN [ ! -e /etc/nsswitch.conf ] && echo 'hosts: files dns' > /etc/nsswitch.conf
```

Though I'm still curious what is causing Kratos to attempt a localhost lookup every 30 seconds, in case anyone knows the answer to that.

**Comment by aeneasr** [comment, marked as answer]
Without logs / reproducible repo not possible to say. Could be anything from DB to DNS to ...

**Reply by jertel** [reply]
There are no log lines output in Kratos when the DNS lookups occur.

The above text explains how to reproduce it. It is consistently reproducible following those steps.

**Reply by jertel** [reply]
Below is an example config that I used against 0.5.5-alpha1 w/ sqlliteDB.

```
selfservice:
  methods:
    password:
      enabled: true
  flows:
    settings:
      ui_url: https://somecrazyhost/?r=/settings
    verification:
      ui_url: https://somecrazyhost/
    login:
      ui_url: https://somecrazyhost/login/
    error:
      ui_url: https://somecrazyhost/login/
    registration:
      ui_url: https://somecrazyhost/login/
  default_browser_return_url: https://somecrazyhost/
  whitelisted_return_urls:
    - http://127.0.0.1
log:
  level: debug
  format: json
secrets:
  default:
    - a234567890123456
serve:
  public: 
    base_url: https://somecrazyhost/auth/
  admin: 
    base_url: https://somecrazyhost/kratos/
hashers:
  argon2:
    parallelism: 2
    memory: 16384
    iterations: 3
    salt_length: 16
    key_length: 32
identity:
  default_schema_url: file:///kratos-conf/schema.json
courier:
  smtp:
    connection_uri: smtps://somecrazyhost:25
```

As I discussed with Thomas in chat, I am really just wondering if you recall a background process that is doing something with localhost on a 30 second interval. The workaround I posted as the first answer to this topic satisfies my needs. So at this point I'm merely trying to learn more about the Kratos process. If the Kratos devs don't know of a background process running on a 30 second interval then that's fine -- it likely means one of the dependent golang libs is doing it and it may be out of scope for this team.

Also, it could be a 30 second cache expiration as well. For example, some Kratos background process is looking up/communicating with localhost on a more frequent interval than 30s, and the 30 second interval is actually due to a DNS cache expiration.

**Reply by aeneasr** [reply]
Could be the mail sender for example. Without the full config (env vars, containers, docker set up), behavior description (are doing sing ups?), infos on how you start the process (sqa enabled?), your os (mac? linux?) it's  whack a mole and I can't help. Best would be a reproducible github repo with e.g. docker compose and an automated script that exactly reproduces the issue.

**Reply by jertel** [reply]
Terminal 1:
```
git clone --depth 1 -b v0.5.5-alpha.1 https://github.com/ory/kratos && cd kratos && docker-compose -f quickstart.yml -f quickstart-standalone.yml up --build --force-recreate
```
Terminal 2:
```
docker exec -it -u root kratos_kratos_1 /bin/sh -c "apk add tcpdump && tcpdump udp port 53"
```

Watch DNS lookups for localhost be requested from your network's DNS on roughly 30 second intervals.

My host is Linux.

**Reply by aeneasr** [reply]
Nice, thanks, that helps a lot!

**Reply by aeneasr** [reply]
So I spent a bit of time on this, this is as far as I got. First, I simplified the set up and removed telemetry:

```
# docker-compose
version: '3.7'

services:
  kratos:
    image: oryd/kratos:v0.5.5-alpha.1.pre.1-sqlite
    ports:
      - "4433:4433" # public
      - "4434:4434" # admin
    restart: unless-stopped
    privileged: true
    environment:
      - DSN=memory
      - LOG_LEVEL=trace
    command:
      serve -c /etc/config/kratos/kratos.yml --dev  --disable-telemetry 
    volumes:
      -
        type: volume
        source: kratos-sqlite
        target: /var/lib/sqlite
        read_only: false
      -
        type: bind
        source: ./contrib/quickstart/kratos/email-password
        target: /etc/config/kratos
    networks:
      - intranet

networks:
  intranet:

volumes:
  kratos-sqlite:
```

I also changed some settings in kratos.yaml:

```
version: v0.4.6-alpha.1

dsn: memory

serve:
  public:
    host: google.com
    base_url: http://127.0.0.1:4433/
    cors:
      enabled: true
  admin:
    host: google.com
    base_url: http://kratos:4434/

selfservice:
  default_browser_return_url: http://127.0.0.1:4455/
  whitelisted_return_urls:
    - http://127.0.0.1:4455

  methods:
    password:
      enabled: true

  flows:
    error:
      ui_url: http://127.0.0.1:4455/error

    settings:
      ui_url: http://127.0.0.1:4455/settings
      privileged_session_max_age: 15m

    recovery:
      enabled: true
      ui_url: http://127.0.0.1:4455/recovery

    verification:
      enabled: true
      ui_url: http://127.0.0.1:4455/verify
      after:
        default_browser_return_url: http://127.0.0.1:4455/

    logout:
      after:
        default_browser_return_url: http://127.0.0.1:4455/auth/login

    login:
      ui_url: http://127.0.0.1:4455/auth/login
      lifespan: 10m

    registration:
      lifespan: 10m
      ui_url: http://127.0.0.1:4455/auth/registration
      after:
        password:
          hooks:
            -
              hook: session

log:
  level: debug
  format: text
  leak_sensitive_values: true

secrets:
  cookie:
    - PLEASE-CHANGE-ME-I-AM-VERY-INSECURE

hashers:
  argon2:
    parallelism: 1
    memory: 131072
    iterations: 2
    salt_length: 16
    key_length: 16

identity:
  default_schema_url: file:///etc/config/kratos/identity.schema.json

courier:
  smtp:
    connection_uri: smtps://test:test@google.com:1025/?skip_ssl_verify=true

```

Ran it using

```
docker-compose -f quickstart.yml up --build --force-recreate
```

And entered using tshark:

```% docker exec -it -u root kratos_kratos_1 /bin/sh -c "apk add tshark && tshark"
(1/23) Installing libffi (3.3-r2)
(2/23) Installing libintl (0.20.2-r0)
(3/23) Installing libblkid (2.35.2-r0)
(4/23) Installing libmount (2.35.2-r0)
(5/23) Installing pcre (8.44-r0)
(6/23) Installing glib (2.64.6-r0)
(7/23) Installing libpcap (1.9.1-r2)
(8/23) Installing brotli-libs (1.0.9-r1)
(9/23) Installing libcap (2.27-r0)
(10/23) Installing c-ares (1.16.1-r0)
(11/23) Installing libgpg-error (1.37-r0)
(12/23) Installing libgcrypt (1.8.5-r0)
(13/23) Installing gmp (6.2.0-r0)
(14/23) Installing nettle (3.5.1-r1)
(15/23) Installing p11-kit (0.23.22-r0)
(16/23) Installing libtasn1 (4.16.0-r1)
(17/23) Installing libunistring (0.9.10-r0)
(18/23) Installing gnutls (3.6.15-r0)
(19/23) Installing lua5.2-libs (5.2.4-r7)
(20/23) Installing nghttp2-libs (1.41.0-r0)
(21/23) Installing libnl3 (3.5.0-r0)
(22/23) Installing wireshark-common (3.2.10-r0)
Executing wireshark-common-3.2.10-r0.pre-install
Executing wireshark-common-3.2.10-r0.post-install
*
* If you want to run wireshark as an unprivileged user
* then you must add that user to the group "wireshark".
*
(23/23) Installing tshark (3.2.10-r0)
Executing busybox-1.31.1-r19.trigger
OK: 115 MiB in 38 packages
Capturing on 'eth0'
    1 0.000000000 fe80::80ee:eff:fed6:38c → ff02::2      ICMPv6 70 Router Solicitation from 82:ee:0e:d6:03:8c
    2 3.006653300   172.18.0.2 → 192.168.65.1 DNS 69 Standard query 0xa91c A localhost
    3 3.006718100   172.18.0.2 → 192.168.65.1 DNS 69 Standard query 0x7382 AAAA localhost
    4 3.008207500 192.168.65.1 → 172.18.0.2   DNS 97 Standard query response 0x7382 AAAA localhost AAAA ::1
    5 3.008417000 192.168.65.1 → 172.18.0.2   DNS 85 Standard query response 0xa91c A localhost A 127.0.0.1
    6 29.184325800 fe80::80ee:eff:fed6:38c → ff02::2      ICMPv6 70 Router Solicitation from 82:ee:0e:d6:03:8c
    7 32.973916400   172.18.0.2 → 192.168.65.1 DNS 69 Standard query 0xb04d A localhost
    8 32.973916400   172.18.0.2 → 192.168.65.1 DNS 69 Standard query 0x3fb3 AAAA localhost
    9 32.975749700 192.168.65.1 → 172.18.0.2   DNS 97 Standard query response 0x3fb3 AAAA localhost AAAA ::1
   10 32.975772400 192.168.65.1 → 172.18.0.2   DNS 85 Standard query response 0xb04d A localhost A 127.0.0.1
   11 38.365262700 02:42:ac:12:00:02 → 02:42:a5:7a:21:8a ARP 42 Who has 172.18.0.1? Tell 172.18.0.2
   12 38.365250600 02:42:a5:7a:21:8a → 02:42:ac:12:00:02 ARP 42 Who has 172.18.0.2? Tell 172.18.0.1
   13 38.365290400 02:42:ac:12:00:02 → 02:42:a5:7a:21:8a ARP 42 172.18.0.2 is at 02:42:ac:12:00:02
   14 38.365307900 02:42:a5:7a:21:8a → 02:42:ac:12:00:02 ARP 42 172.18.0.1 is at 02:42:a5:7a:21:8a

```

Which returned a couple of DNS queries on localhost (as described in the OP). The 172.18.0.2 reverse lookups look to me as if Kraots is trying to find some container in the local network. The only candidates left IMO are SQLite and SMTP as we have no other periodic calls to anything.

It might also be related to prometheus or open tracing (?).

For sanity check I created a minimal http go server:

```

package main

import (
	"fmt"
	"log"
	"net/http"
)

func handler(w http.ResponseWriter, r *http.Request) {
	fmt.Fprintf(w, "Hi there, I love %s!", r.URL.Path[1:])
}

func main() {
	http.HandleFunc("/", handler)
	log.Fatal(http.ListenAndServe(":8080", nil))
}
```

with a similar Dockerfile:

```
FROM golang:1.15-alpine AS builder

RUN apk -U --no-cache add build-base git gcc bash

WORKDIR /go/src/github.com/ory/kratos/bla

ADD . .

RUN go build -tags sqlite -o /usr/bin/kratos

FROM alpine:3.12

RUN addgroup -S ory; \
    adduser -S ory -G ory -D  -h /home/ory -s /bin/nologin; \
    chown -R ory:ory /home/ory

COPY --from=builder /usr/bin/kratos /usr/bin/kratos

# By creating the sqlite folder as the ory user, the mounted volume will be owned by ory:ory, which
# is required for read/write of SQLite.
RUN mkdir -p /var/lib/sqlite
RUN chown ory:ory /var/lib/sqlite
VOLUME /var/lib/sqlite

# Exposing the ory home directory to simplify passing in Kratos configuration (e.g. if the file $HOME/.kratos.yaml
# exists, it will be automatically used as the configuration file).
VOLUME /home/ory

# Declare the standard ports used by Kratos (4433 for public service endpoint, 4434 for admin service endpoint)
EXPOSE 4433 4434

USER ory

ENTRYPOINT ["kratos"]
```

But could not see any traffic.

If you're interested in trying to find the source, it would definitely be interesting to understand what's going on!

**Reply by jertel** [reply]
Thanks for the pointers. I'll post back if I get some time to dig further.

**Reply by aeneasr** [reply]
Ok cool! I'm honestly intrigued to learn what is going on there. I think the explanation is very simple. I also made sure to check if we're actually doing any tcp traffic but it does indeed look like a DNS lookup only. I still think it's caused by SMTP.

**Reply by aeneasr** [reply]
This will probably be auto-fixed with Go 1.16:

> On Linux, host name lookups no longer use DNS before checking /etc/hosts when /etc/nsswitch.conf is missing; this is common on musl-based systems and makes Go programs match the behavior of C programs on those systems.

**Reply by jertel** [reply]
Good find. Thanks!

**Reply by jertel** [reply]
I've confirmed that the DNS lookup noise is caused by the import of the `github.com/ory/x/tracing` package.

Unfortunately, the mere import alone is all that's necessary to cause the repeating localhost lookups. Choosing not to activate the tracing is irrelevant. I do not see any code in the `ory/x/tracing` package that would cause this, so that would likely suggest that one of the third-party imports, such as open-tracing, jaeger, datadog, elastic, etc. has some code, such as a package init() function, that is spawning an async thread in the background. 

I've reached my time limit on this research, perhaps someone else could take the next step of isolating which dependent package inside of the ory/x/tracing package is causing this. Or kratos could offer a build switch that prevented the tracing package from being imported.

**Reply by aeneasr** [reply]
Wow, nice find! That's definitely already worth a lot. I'm pretty sure that it's one of the connectors. Maybe they are trying to find an agent on the local host to set up tracing - not sure.

Thank you for spending time on this!
